{
  "id": "2022-03-05-schalke-vivawest",
  "date": "2022-03-05",
  "datePrecision": "day",
  "clubId": "schalke-04",
  "sponsorId": "gazprom",
  "kind": "better",
  "levelAfter": "not-rated",
  "title": "Schalke foiled over Gazprom mid-season",
  "text": "Schalke ended a 15-year Gazprom deal days after the invasion of Ukraine and covered the logo with Vivawest, initially a deal to the end of the season.",
  "source": {
    "name": "FC Schalke 04, VIVAWEST become new partner",
    "date": "2022-03-05",
    "url": "https://schalke04.de/en/partner-en/vivawest-become-new-partner-fc-schalke-04"
  }
}
