{
  "id": "2026-04-liverpool-turkish-airlines",
  "date": "2026-04",
  "datePrecision": "month",
  "clubId": "liverpool",
  "sponsorId": "turkish-airlines",
  "kind": "being-rated",
  "levelAfter": "not-rated",
  "title": "Turkish Airlines from 2027/28",
  "text": "Replaces Standard Chartered. The airline is part-owned by Türkiye’s wealth fund. We are checking it now.",
  "source": {
    "name": "Footy Headlines",
    "date": "2026-04",
    "url": "https://www.footyheadlines.com/2026/04/lfc-new-sponsor.html"
  }
}
