{
  "id": "2026-06-newcastle-sela-ends",
  "date": "2026-06",
  "datePrecision": "month",
  "clubId": "newcastle-united",
  "sponsorId": "sela",
  "kind": "better",
  "levelAfter": "spotted",
  "title": "Saudi-owned Sela is off the front",
  "text": "A drinks brand replaces it. noon, part-owned by the same Saudi state fund, stays on the sleeve.",
  "source": {
    "name": "The Mag",
    "date": "2026-06",
    "url": "https://www.themag.co.uk/2026/06/newcastle-united-have-agreed-new-main-sponsor-front-of-shirt-three-year-deal-to-replace-sela/"
  }
}
